{
  "spec_version": 1,
  "title": "Forge Corrector Repeat Cap Smoke Test",
  "architecture_overview": "This OperatorSpec introduces a configuration parameter to limit the number of repeats for the forge corrector process. This is a smoke test to establish the configuration point and a placeholder for its enforcement in the relevant script, ensuring operational stability and preventing infinite loops or resource exhaustion during forge operations.",
  "constraints": [
    "Keep T440 P100 LLM ports (:5001/:5002 on 10.0.0.61) free during satellite runs."
  ],
  "repo_root": "/data/codebase/repos/wreckhunter2000-1",
  "needs_user_approval": true,
  "risks": [
    "The `forge_corrector_max_repeats` value in `cluster_config.toml` must be carefully chosen to avoid prematurely terminating essential corrector operations.",
    "The placeholder implementation in `cesarops2-forge-edge.sh` is not functional and requires a follow-up task to parse TOML and integrate the capping logic."
  ],
  "ordered_tasks": [
    {
      "target_file_path": "/data/codebase/repos/wreckhunter2000-1/cesarops-forge-v2/cluster_config.toml",
      "injected_context_files": [],
      "explicit_steps": [
        "Open the file /data/codebase/repos/wreckhunter2000-1/cesarops-forge-v2/cluster_config.toml.",
        "Locate or create a section named `[forge_settings]`.",
        "Add a new entry `forge_corrector_max_repeats = 3` within the `[forge_settings]` section.",
        "Add a comment on the line above the new entry: `# Maximum number of times the forge corrector can repeat an operation before exiting.`"
      ],
      "done_condition": "The `cluster_config.toml` file contains `[forge_settings]` with `forge_corrector_max_repeats = 3` and the specified explanatory comment."
    },
    {
      "target_file_path": "/data/codebase/repos/wreckhunter2000-1/scripts/cesarops2-forge-edge.sh",
      "injected_context_files": [
        "/data/codebase/repos/wreckhunter2000-1/cesarops-forge-v2/cluster_config.toml"
      ],
      "explicit_steps": [
        "Open the file /data/codebase/repos/wreckhunter2000-1/scripts/cesarops2-forge-edge.sh.",
        "Identify the main loop or function responsible for initiating 'forge corrector' operations.",
        "Above the identified loop/function, add a placeholder comment: `# TODO: Implement logic to read 'forge_corrector_max_repeats' from cluster_config.toml and enforce this limit on corrector iterations.`",
        "Below the comment, add a temporary default variable for local testing: `FORGE_CORRECTOR_MAX_REPEATS_DEFAULT=3`."
      ],
      "done_condition": "The `cesarops2-forge-edge.sh` script contains the specified placeholder comment and the `FORGE_CORRECTOR_MAX_REPEATS_DEFAULT` variable assignment."
    }
  ]
}